{
  "version": "0.1",
  "stream_id": "audit-stream-main",
  "sequence": 1,
  "prev_event_hash": "sha256:0000000000000000000000000000000000000000000000000000000000000000",
  "emitted_at": "2026-04-13T14:30:30Z",
  "source_id": "audit-main",
  "trace": "trace-burn-001",
  "event_type": "decision.burn",
  "payload_hash": "sha256:e632a695afc7fa9560d719a1f82327e0898ea21791168c08a2a99dc0d1bbb455",
  "labels": [],
  "decision_status": "burn",
  "notes": "",
  "event_hash": "sha256:ed805c675fec7cb6071e0c46eeb41634b54542a79a0ad1c0417919716cc97ce6"
}
