{
  "version": "0.1",
  "stream_id": "audit-stream-main",
  "sequence": 1,
  "prev_event_hash": "sha256:0000000000000000000000000000000000000000000000000000000000000000",
  "emitted_at": "2026-04-13T14:30:30Z",
  "source_id": "audit-main",
  "trace": "trace-allow-001",
  "event_type": "decision.allow",
  "payload_hash": "sha256:caacdf2cda725b508707249e79be505a9cd80c07e822cbf90641d3facf77e28c",
  "labels": [],
  "decision_status": "accept",
  "notes": "",
  "event_hash": "sha256:1b47b39953862200d472fbc088e435646537601542c9348537dc5f3d8258c2f5"
}
