{
  "version": "0.1",
  "stream_id": "audit-stream-main",
  "sequence": 1,
  "prev_event_hash": "sha256:0000000000000000000000000000000000000000000000000000000000000000",
  "emitted_at": "2026-04-13T14:30:30Z",
  "source_id": "audit-main",
  "trace": "trace-allow-001",
  "event_type": "decision.deny",
  "payload_hash": "sha256:267a74ed3c36d1c949de0f6a7750bd7757a943e1b7389ca4f1879cc913a1b051",
  "labels": [],
  "decision_status": "deny",
  "notes": "",
  "event_hash": "sha256:4c4a4a1fe744cb28a1a9bba760ae9e996f21fc7116ef86ea745d3bef4b0a3484"
}
